Symbol,Name,Country,IPO Year,Sector,Industry
ICCC,ImmuCell Corporation Common Stock,United States,1987,Health Care,Biotechnology: In Vitro & In Vivo Diagnostic Substances
ICCH,ICC Holdings Inc. Common Stock,United States,2017,Finance,Property-Casualty Insurers
ICE,Intercontinental Exchange Inc. Common Stock,United States,2005,Finance,Investment Bankers/Brokers/Service
ICFI,ICF International Inc. Common Stock,United States,2006,Consumer Discretionary,Professional Services
ICHR,Ichor Holdings Ordinary Shares,United States,2016,Technology,Semiconductors
ICMB,Investcorp Credit Management BDC Inc. Common Stock,United States,2014,Finance,Finance: Consumer Services
ICPT,Intercept Pharmaceuticals Inc. Common Stock,United States,2012,Health Care,Biotechnology: Pharmaceutical Preparations
ICU,SeaStar Medical Holding Corporation Common Stock,United States,2021,Health Care,Biotechnology: Pharmaceutical Preparations
ICUCW,SeaStar Medical Holding Corporation Warrant,United States,2021,Health Care,Biotechnology: Pharmaceutical Preparations
ICUI,ICU Medical Inc. Common Stock,United States,1992,Health Care,Medical/Dental Instruments
ICVX,Icosavax Inc. Common Stock,United States,2021,Health Care,Biotechnology: Pharmaceutical Preparations
ID,PARTS iD Inc. Class A Common Stock,United States,2017,Consumer Discretionary,Advertising
IDE,Voya Infrastructure Industrials and Materials Fund Common Shares of Beneficial Interest,United States,2010,Finance,Finance/Investors Services
IDN,Intellicheck Inc. Common Stock,United States,1999,Technology,Computer Software: Prepackaged Software
IDXX,IDEXX Laboratories Inc. Common Stock,United States,1991,Health Care,Biotechnology: In Vitro & In Vivo Diagnostic Substances
IDYA,IDEAYA Biosciences Inc. Common Stock,United States,2019,Health Care,Biotechnology: Pharmaceutical Preparations
IEX,IDEX Corporation Common Stock,United States,1989,Industrials,Fluid Controls
IGA,Voya Global Advantage and Premium Opportunity Fund Common Shares of Beneficial Interest,United States,2005,Finance,Investment Managers
IGD,Voya Global Equity Dividend and Premium Opportunity Fund,United States,2005,Finance,Trusts Except Educational Religious and Charitable
IGI,Western Asset Investment Grade Defined Opportunity Trust Inc. Common Stock,United States,2009,Finance,Investment Managers
IGMS,IGM Biosciences Inc. Common Stock,United States,2019,Health Care,Biotechnology: Pharmaceutical Preparations
IGR,CBRE Global Real Estate Income Fund Common Shares of Beneficial Interest,United States,2004,Finance,Finance Companies
IGT,International Game Technology Ordinary Shares,United States,2015,Consumer Discretionary,Services-Misc. Amusement & Recreation
IGTA,Inception Growth Acquisition Limited Common Stock,United States,2022,Finance,Blank Checks
IGTAR,Inception Growth Acquisition Limited Rights,United States,2022,Finance,Blank Checks
IGTAW,Inception Growth Acquisition Limited Warrants,United States,2022,Finance,Blank Checks
IH,iHuman Inc. American depositary shares each representing five Class A ordinary shares,United States,2020,Consumer Discretionary,Educational Services
IHD,Voya Emerging Markets High Income Dividend Equity Fund Common Shares,United States,2011,Finance,Investment Managers
IHIT,Invesco High Income 2023 Target Term Fund Common Shares of Beneficial Interest,United States,2016,Finance,Investment Managers
IHT,InnSuites Hospitality Trust Shares of Beneficial Interest,United States,1999,Real Estate,Real Estate Investment Trusts
IIF,Morgan Stanley India Investment Fund Inc. Common Stock,United States,1994,Finance,Trusts Except Educational Religious and Charitable
IIIV,i3 Verticals Inc. Class A Common Stock,United States,2018,Consumer Discretionary,Business Services
IIPR,Innovative Industrial Properties Inc. Common Stock,United States,2016,Finance,Real Estate
IKNA,Ikena Oncology Inc. Common Stock,United States,2021,Health Care,Biotechnology: Pharmaceutical Preparations
IKT,Inhibikase Therapeutics Inc. Common Stock,United States,2020,Health Care,Biotechnology: Pharmaceutical Preparations
ILMN,Illumina Inc. Common Stock,United States,2000,Health Care,Medical Specialities
ILPT,Industrial Logistics Properties Trust Common Shares of Beneficial Interest,United States,2018,Real Estate,Real Estate Investment Trusts
IMACW,IMAC Holdings Inc. Warrant,United States,2019,Health Care,Medical Specialities
IMAQ,International Media Acquisition Corp. Class A Common Stock,United States,2021,Consumer Discretionary,Movies/Entertainment
IMAQR,International Media Acquisition Corp. Rights,United States,2021,Consumer Discretionary,Movies/Entertainment
IMAQW,International Media Acquisition Corp. Warrants,United States,2021,Consumer Discretionary,Movies/Entertainment
IMGN,ImmunoGen Inc. Common Stock,United States,1989,Health Care,Biotechnology: Pharmaceutical Preparations
IMKTA,Ingles Markets Incorporated Class A Common Stock,United States,1987,Consumer Staples,Food Chains
IMMR,Immersion Corporation Common Stock,United States,1999,Technology,Computer peripheral equipment
IMMX,Immix Biopharma Inc. Common Stock,United States,2021,Health Care, Medicinal Chemicals and Botanical Products 
IMNM,Immunome Inc. Common Stock,United States,2020,Health Care, Medicinal Chemicals and Botanical Products 
IMPL,Impel Pharmaceuticals Inc. Common Stock,United States,2021,Health Care,Biotechnology: Pharmaceutical Preparations
IMRX,Immuneering Corporation Class A Common Stock,United States,2021,Health Care,Biotechnology: Pharmaceutical Preparations
IMUX,Immunic Inc. Common Stock,United States,2014,Health Care,Biotechnology: Pharmaceutical Preparations
IMVT,Immunovant Inc. Common Stock,United States,2019,Health Care,Biotechnology: Biological Products (No Diagnostic Substances)
IMXI,International Money Express Inc. Common Stock,United States,2017,Consumer Discretionary,Business Services
INAB,IN8bio Inc. Common Stock,United States,2021,Health Care,Biotechnology: Pharmaceutical Preparations
INBS,Intelligent Bio Solutions Inc. Common Stock,United States,2020,Health Care,Medical Specialities
INBX,Inhibrx Inc. Common Stock,United States,2020,Health Care,Biotechnology: Pharmaceutical Preparations
INFA,Informatica Inc. Class A Common Stock,United States,2021,Technology,EDP Services
INFN,Infinera Corporation Common Stock,United States,2007,Utilities,Telecommunications Equipment
INGN,Inogen Inc Common Stock,United States,2014,Health Care,Industrial Specialties
INKT,MiNK Therapeutics Inc. Common Stock,United States,2021,Health Care, Medicinal Chemicals and Botanical Products 
INMB,INmune Bio Inc. Common stock,United States,2019,Health Care,Biotechnology: Pharmaceutical Preparations
INN,Summit Hotel Properties Inc. Common Stock,United States,2011,Real Estate,Real Estate Investment Trusts
INNV,InnovAge Holding Corp. Common Stock,United States,2021,Health Care,Medical/Nursing Services
INOD,Innodata Inc. Common Stock,United States,1993,Technology,EDP Services
INPX,Inpixon Common Stock,United States,2014,Technology,EDP Services
INSE,Inspired Entertainment Inc. Common Stock,United States,2014,Technology,Computer Software: Prepackaged Software
INSP,Inspire Medical Systems Inc. Common Stock,United States,1998,Health Care,Medical/Dental Instruments
INSW,International Seaways Inc. Common Stock ,United States,2016,Consumer Discretionary,Marine Transportation
INTA,Intapp Inc. Common Stock,United States,2021,Technology,Computer Software: Prepackaged Software
INTE,Integral Acquisition Corporation 1 Class A Common Stock,United States,2021,Finance,Blank Checks
INTEU,Integral Acquisition Corporation 1 Unit,United States,2021,Finance,Blank Checks
INTEW,Integral Acquisition Corporation 1 Warrants,United States,2021,Finance,Blank Checks
INTS,Intensity Therapeutics Inc. Common stock,United States,2023,Health Care,Biotechnology: Pharmaceutical Preparations
INTT,inTest Corporation Common Stock,United States,1997,Technology,Semiconductors
INTU,Intuit Inc. Common Stock,United States,1993,Technology,Computer Software: Prepackaged Software
INVA,Innoviva Inc. Common Stock,United States,2004,Health Care,Biotechnology: Pharmaceutical Preparations
INVH,Invitation Homes Inc. Common Stock,United States,2017,Real Estate,Real Estate Investment Trusts
INZY,Inozyme Pharma Inc. Common Stock,United States,2020,Health Care,Biotechnology: Pharmaceutical Preparations
IOAC,Innovative International Acquisition Corp. Class A Ordinary Shares,United States,2022,Finance,Blank Checks
IOACW,Innovative International Acquisition Corp. Warrants,United States,2022,Finance,Blank Checks
IONQ,IonQ Inc. Common Stock,United States,2021,Industrials,Wholesale Distributors
IOR,Income Opportunity Realty Investors Inc. Common Stock,United States,1987,Real Estate,Real Estate Investment Trusts
IOT,Samsara Inc. Class A Common Stock,United States,2021,Technology,Retail: Computer Software & Peripheral Equipment
IPDN,Professional Diversity Network Inc. Common Stock,United States,2013,Technology,EDP Services
IPGP,IPG Photonics Corporation Common Stock,United States,2006,Technology,Semiconductors
IPI,Intrepid Potash Inc Common Stock,United States,2008,Industrials,Mining & Quarrying of Nonmetallic Minerals (No Fuels)
IPSC,Century Therapeutics Inc. Common Stock,United States,2021,Health Care, Medicinal Chemicals and Botanical Products 
IPW,iPower Inc. Common Stock,United States,2021,Consumer Discretionary,Catalog/Specialty Distribution
IPWR,Ideal Power Inc. Common Stock,United States,2013,Industrials,Industrial Machinery/Components
IPXX,Inflection Point Acquisition Corp. II Class A Ordinary Share,United States,2023,Finance,Blank Checks
IPXXU,Inflection Point Acquisition Corp. II Unit,United States,2023,Finance,Blank Checks
IPXXW,Inflection Point Acquisition Corp. II Warrant,United States,2023,Finance,Blank Checks
IQV,IQVIA Holdings Inc. Common Stock,United States,2013,Health Care,Biotechnology: Commercial Physical & Biological Resarch
IR,Ingersoll Rand Inc. Common Stock,United States,2017,Industrials,Industrial Machinery/Components
IRAA,Iris Acquisition Corp Class A Common Stock,United States,2021,Finance,Blank Checks
IRAAU,Iris Acquisition Corp Units,United States,2021,Finance,Blank Checks
IRAAW,Iris Acquisition Corp Warrant,United States,2021,Finance,Blank Checks
IRBT,iRobot Corporation Common Stock,United States,2005,Consumer Discretionary,Consumer Electronics/Appliances
IRIX,IRIDEX Corporation Common Stock,United States,1996,Health Care,Biotechnology: Electromedical & Electrotherapeutic Apparatus
IRMD,iRadimed Corporation Common Stock,United States,2014,Health Care,Medical/Dental Instruments
IROQ,IF Bancorp Inc. Common Stock,United States,2011,Finance,Savings Institutions
IRT,Independence Realty Trust Inc. Common Stock,United States,2013,Real Estate,Real Estate Investment Trusts
IRTC,iRhythm Technologies Inc. Common Stock,United States,2016,Health Care,Medical/Dental Instruments
IRWD,Ironwood Pharmaceuticals Inc. Class A Common Stock,United States,2010,Health Care,Biotechnology: Pharmaceutical Preparations
ISD,PGIM High Yield Bond Fund Inc.,United States,2012,Finance,Trusts Except Educational Religious and Charitable
ISPC,iSpecimen Inc. Common Stock,United States,2021,Health Care,Precision Instruments
ISPO,Inspirato Incorporated Class A Common Stock,United States,2021,Finance,Blank Checks
ISPOW,Inspirato Incorporated Warrant,United States,2021,Finance,Blank Checks
ISPR,Ispire Technology Inc. Common Stock,United States,2023,Health Care, Medicinal Chemicals and Botanical Products 
ISRG,Intuitive Surgical Inc. Common Stock,United States,2000,Health Care,Medical/Dental Instruments
ISRL,Israel Acquisitions Corp Class A Ordinary Shares,United States,2023,Finance,Blank Checks
ISRLU,Israel Acquisitions Corp Unit,United States,2023,Finance,Blank Checks
ISRLW,Israel Acquisitions Corp Warrant,United States,2023,Finance,Blank Checks
ISSC,Innovative Solutions and Support Inc. Common Stock,United States,2000,Technology,EDP Services
ISTR,Investar Holding Corporation Common Stock,United States,2014,Finance,Major Banks
ISUN,iSun Inc. Common Stock,United States,2016,Technology,Semiconductors
IT,Gartner Inc. Common Stock,United States,1993,Consumer Discretionary,Other Consumer Services
ITAQW,Industrial Tech Acquisitions II Inc. Warrants,United States,2022,Industrials,Major Chemicals
ITOS,iTeos Therapeutics Inc. Common Stock,United States,2020,Health Care,Biotechnology: Biological Products (No Diagnostic Substances)
ITRI,Itron Inc. Common Stock,United States,1993,Industrials,Electrical Products
ITT,ITT Inc. Common Stock ,United States,2011,Industrials,Fluid Controls
IVAC,Intevac Inc. Common Stock,United States,1995,Technology,Industrial Machinery/Components
IVCP,Swiftmerge Acquisition Corp. Class A Ordinary Share,United States,2022,Finance,Blank Checks
IVCPU,Swiftmerge Acquisition Corp. Unit,United States,2021,Finance,Blank Checks
IVP,Inspire Veterinary Partners Inc. Class A Common Stock,United States,2023,Miscellaneous,Diversified Commercial Services
IVR,INVESCO MORTGAGE CAPITAL INC Common Stock,United States,2009,Real Estate,Real Estate Investment Trusts
IVT,InvenTrust Properties Corp. Common Stock,United States,2021,Real Estate,Real Estate Investment Trusts
IVVD,Invivyd Inc. Common Stock,United States,2021,Health Care,Biotechnology: Pharmaceutical Preparations
J,Jacobs Solutions Inc. Common Stock,United States,2022,Industrials,Military/Government/Technical
JAGX,Jaguar Health Inc. Common Stock,United States,2015,Health Care,Biotechnology: Pharmaceutical Preparations
JAKK,JAKKS Pacific Inc. Common Stock,United States,1996,Consumer Discretionary,Recreational Games/Products/Toys
JAMF,Jamf Holding Corp. Common Stock,United States,2020,Technology,Computer Software: Prepackaged Software
JANX,Janux Therapeutics Inc. Common Stock,United States,2021,Health Care,Biotechnology: Pharmaceutical Preparations
JAQC,Jupiter Acquisition Corporation Common stock,United States,2021,Finance,Blank Checks
JAQCU,Jupiter Acquisition Corporation Units,United States,2021,Finance,Blank Checks
JAQCW,Jupiter Acquisition Corporation Warrants,United States,2021,Finance,Blank Checks
JBGS,JBG SMITH Properties Common Shares ,United States,2017,Real Estate,Real Estate Investment Trusts
JBI,Janus International Group Inc. Common Stock,United States,2021,Industrials,Building Products
JBL,Jabil Inc. Common Stock,United States,1993,Technology,Electrical Products
JBLU,JetBlue Airways Corporation Common Stock,United States,2002,Consumer Discretionary,Air Freight/Delivery Services
JBSS,John B. Sanfilippo & Son Inc. Common Stock,United States,1991,Consumer Staples,Specialty Foods
JCE,Nuveen Core Equity Alpha Fund Common Shares of Beneficial Interest,United States,2007,Finance,Trusts Except Educational Religious and Charitable
JELD,JELD-WEN Holding Inc. Common Stock,United States,2017,Basic Materials,Forest Products
JEQ,abrdn Japan Equity Fund Inc. Common Stock,United States,1992,Consumer Discretionary,Air Freight/Delivery Services
JEWL,Adamas One Corp. Common Stock,United States,2022,Consumer Discretionary,Consumer Specialties
JFR,Nuveen Floating Rate Income Fund Common Stock,United States,2004,Finance,Trusts Except Educational Religious and Charitable
JGGC,Jaguar Global Growth Corporation I Class A Ordinary Shares,United States,2022,Finance,Blank Checks
JGGCR,Jaguar Global Growth Corporation I Right,United States,2022,Finance,Blank Checks
JGGCW,Jaguar Global Growth Corporation I Warrant,United States,2022,Finance,Blank Checks
JGH,Nuveen Global High Income Fund Common Shares of Beneficial Interest,United States,2014,Finance,Investment Managers
JILL,J. Jill Inc. Common Stock,United States,2017,Consumer Discretionary,Clothing/Shoe/Accessory Stores
JJSF,J & J Snack Foods Corp. Common Stock,United States,1986,Consumer Staples,Specialty Foods
JKHY,Jack Henry & Associates Inc. Common Stock,United States,1985,Technology,Retail: Computer Software & Peripheral Equipment
JLS,Nuveen Mortgage and Income Fund,United States,2009,Finance,Investment Managers
JNPR,Juniper Networks Inc. Common Stock,United States,1999,Telecommunications,Computer Communications Equipment
JNVR,Janover Inc. Common Stock,United States,2023,,
JOAN,JOANN Inc. Common Stock,United States,2021,Consumer Discretionary,Other Specialty Stores
JOB,GEE Group Inc. Common Stock,United States,1968,Consumer Discretionary,Diversified Commercial Services
JOBY,Joby Aviation Inc. Common Stock,United States,2020,Consumer Discretionary,Aerospace
JOF,Japan Smaller Capitalization Fund Inc Common Stock,United States,1990,Finance,Trusts Except Educational Religious and Charitable
JPC,Nuveen Preferred & Income Opportunities Fund,United States,2003,Finance,Investment Managers
JPS,Nuveen Preferred & Income Securities Fund,United States,2002,Finance,Investment Managers
JPT,Nuveen Preferred and Income Fund Common Shares of Beneficial Interest,United States,2017,Finance,Trusts Except Educational Religious and Charitable
JQC,Nuveen Credit Strategies Income Fund Shares of Beneficial Interest,United States,2003,Finance,Finance Companies
JRI,Nuveen Real Asset Income and Growth Fund Common Shares of Beneficial Interest,United States,2012,Finance,Finance Companies
JRS,Nuveen Real Estate Income Fund Common Shares of Beneficial Interest,United States,2001,Finance,Finance/Investors Services
JRSH,Jerash Holdings (US) Inc. Common Stock,United States,2018,Consumer Discretionary,Apparel
JSPR,Jasper Therapeutics Inc. Common Stock,United States,2020,Health Care,Biotechnology: Biological Products (No Diagnostic Substances)
JSPRW,Japer Therapeutics Inc. Warrants,United States,2020,Health Care,Biotechnology: Biological Products (No Diagnostic Substances)
JVA,Coffee Holding Co. Inc. Common Stock,United States,2005,Consumer Staples,Packaged Foods
JXN,Jackson Financial Inc. Class A Common Stock ,United States,2021,Finance,Life Insurance
JYNT,The Joint Corp. Common Stock,United States,2014,Miscellaneous,Multi-Sector Companies
KA,Kineta Inc. Common Stock,United States,2016,Health Care,Biotechnology: Pharmaceutical Preparations
KAI,Kadant Inc Common Stock,United States,1992,Industrials,Industrial Machinery/Components
KALA,KALA BIO Inc. Common Stock,United States,2017,Health Care,Biotechnology: Pharmaceutical Preparations
KAR,OPENLANE Inc. Common Stock,United States,2009,Consumer Discretionary,Retail-Auto Dealers and Gas Stations
KBH,KB Home Common Stock,United States,1986,Consumer Discretionary,Homebuilding
KBNT,Kubient Inc. Common Stock,United States,2020,Technology,EDP Services
KBR,KBR Inc. Common Stock,United States,2006,Industrials,Military/Government/Technical
KD,Kyndryl Holdings Inc. Common Stock,United States,2021,Technology,EDP Services
KERN,Akerna Corp. Common Stock,United States,2018,Technology,EDP Services
KERNW,Akerna Corp Warrant,United States,2018,Technology,EDP Services
KEYS,Keysight Technologies Inc. Common Stock,United States,2014,Industrials,Industrial Machinery/Components
KFFB,Kentucky First Federal Bancorp Common Stock,United States,2005,Finance,Savings Institutions
KFRC,Kforce Inc. Common Stock,United States,1995,Consumer Discretionary,Professional Services
KFY,Korn Ferry Common Stock,United States,1999,Consumer Discretionary,Diversified Commercial Services
KIDS,OrthoPediatrics Corp. Common Stock,United States,2017,Health Care,Medical/Dental Instruments
KIRK,Kirkland's Inc. COMMONSTOCK,United States,2002,Miscellaneous,Diversified Commercial Services
KITT,Nauticus Robotics Inc. Common stock,United States,2021,Industrials,Industrial Machinery/Components
KITTW,Nauticus Robotics Inc. Warrant,United States,2021,Industrials,Industrial Machinery/Components
KKRS,KKR Group Finance Co. IX LLC 4.625% Subordinated Notes due 2061,United States,2021,,
KLAC,KLA Corporation Common Stock,United States,1980,Technology,Electronic Components
KLR,Kaleyra Inc. Common Stock,United States,2018,Technology,EDP Services
KLTR,Kaltura Inc. Common Stock,United States,2021,Technology,EDP Services
KMI,Kinder Morgan Inc. Common Stock,United States,2011,Utilities,Natural Gas Distribution
KMPB,Kemper Corporation 5.875% Fixed-Rate Reset Junior Subordinated Debentures due 2062,United States,2022,Finance,Property-Casualty Insurers
KN,Knowles Corporation Common Stock,United States,2014,Consumer Staples,Consumer Electronics/Appliances
KNF,Knife Riv Holding Co. Common Stock,United States,2023,,
KNSA,Kiniksa Pharmaceuticals Ltd. Class A Common Stock,United States,2018,Health Care,Biotechnology: Pharmaceutical Preparations
KNTE,Kinnate Biopharma Inc. Common Stock,United States,2020,Health Care,Biotechnology: Pharmaceutical Preparations
KNTK,Kinetik Holdings Inc. Class A Common Stock,United States,2022,Energy,Oil & Gas Production
KNX,Knight-Swift Transportation Holdings Inc.,United States,2017,Industrials,Trucking Freight/Courier Services
KOD,Kodiak Sciences Inc Common Stock,United States,2018,Health Care,Biotechnology: Biological Products (No Diagnostic Substances)
KOP,Koppers Holdings Inc. Common Stock,United States,2006,Basic Materials,Forest Products
KOPN,Kopin Corporation Common Stock,United States,1992,Technology,Industrial Machinery/Components
KPLT,Katapult Holdings Inc. Common Stock,United States,2019,Consumer Discretionary,Diversified Commercial Services
KPLTW,Katapult Holdings Inc. Warrant,United States,2019,Consumer Discretionary,Diversified Commercial Services
KPTI,Karyopharm Therapeutics Inc. Common Stock,United States,2013,Health Care,Biotechnology: Pharmaceutical Preparations
KRC,Kilroy Realty Corporation Common Stock,United States,1997,Real Estate,Real Estate Investment Trusts
KREF,KKR Real Estate Finance Trust Inc. Common Stock,United States,2017,Real Estate,Real Estate Investment Trusts
KRG,Kite Realty Group Trust Common Stock,United States,2004,Real Estate,Real Estate Investment Trusts
KRNL,Kernel Group Holdings Inc. Class A Ordinary Shares,United States,2021,Finance,Blank Checks
KRNLW,Kernel Group Holdings Inc. Warrants,United States,2021,Finance,Blank Checks
KRNY,Kearny Financial Corp Common Stock,United States,2005,Finance,Savings Institutions
KRON,Kronos Bio Inc. Common Stock,United States,2020,Health Care, Medicinal Chemicals and Botanical Products 
KROS,Keros Therapeutics Inc. Common Stock,United States,2020,Health Care,Biotechnology: Pharmaceutical Preparations
KRP,Kimbell Royalty Partners Common Units Representing Limited Partner Interests,United States,2017,Energy,Oil & Gas Production
KRT,Karat Packaging Inc. Common Stock,United States,2021,Industrials,Plastic Products
KRTX,Karuna Therapeutics Inc. Common Stock,United States,2019,Health Care,Biotechnology: Pharmaceutical Preparations
KRUS,Kura Sushi USA Inc. Class A Common Stock,United States,2019,Consumer Discretionary,Restaurants
KRYS,Krystal Biotech Inc. Common Stock,United States,2017,Health Care,Biotechnology: Biological Products (No Diagnostic Substances)
KSCP,Knightscope Inc. Class A Common Stock,United States,2022,Telecommunications,Telecommunications Equipment
KSM,DWS Strategic Municipal Income Trust,United States,1989,Finance,Trusts Except Educational Religious and Charitable
KSS,Kohl's Corporation Common Stock,United States,1992,Consumer Discretionary,Department/Specialty Retail Stores
KTB,Kontoor Brands Inc. Common Stock ,United States,2019,Consumer Discretionary,Apparel
KTCC,Key Tronic Corporation Common Stock,United States,1983,Technology,Electrical Products
KTF,DWS Municipal Income Trust,United States,1988,Finance,Finance Companies
KTTA,Pasithea Therapeutics Corp. Common Stock,United States,2021,Health Care,Biotechnology: Pharmaceutical Preparations
KTTAW,Pasithea Therapeutics Corp. Warrant,United States,2021,Health Care,Biotechnology: Pharmaceutical Preparations
KVACU,Keen Vision Acquisition Corporation Units,United States,2023,,
KVHI,KVH Industries Inc. Common Stock,United States,1996,Technology,Radio And Television Broadcasting And Communications Equipment
KVSA,Khosla Ventures Acquisition Co. Class A Common Stock,United States,2021,Health Care,Biotechnology: Pharmaceutical Preparations
KYCH,Keyarch Acquisition Corporation Ordinary Shares,United States,2022,Finance,Blank Checks
KYCHR,Keyarch Acquisition Corporation Rights,United States,2022,Finance,Blank Checks
KYCHW,Keyarch Acquisition Corporation Warrant,United States,2022,Finance,Blank Checks
KYMR,Kymera Therapeutics Inc. Common Stock,United States,2020,Health Care, Medicinal Chemicals and Botanical Products 
KYN,Kayne Anderson Energy Infrastructure Fund Inc.,United States,2004,Finance,Finance/Investors Services
KZR,Kezar Life Sciences Inc. Common Stock,United States,2018,Health Care,Biotechnology: Pharmaceutical Preparations
LAB,Standard BioTools Inc. Common Stock,United States,2011,Industrials,Biotechnology: Laboratory Analytical Instruments
LABP,Landos Biopharma Inc. Common Stock,United States,2021,Health Care, Medicinal Chemicals and Botanical Products 
LADR,Ladder Capital Corp Class A Common Stock,United States,2014,Real Estate,Real Estate Investment Trusts
LAKE,Lakeland Industries Inc. Common Stock,United States,1986,Health Care,Industrial Specialties
LAMR,Lamar Advertising Company Class A Common Stock,United States,1996,Real Estate,Real Estate Investment Trusts
LAND,Gladstone Land Corporation Common Stock,United States,2013,Real Estate,Real Estate Investment Trusts
LASE,Laser Photonics Corporation Common Stock,United States,2022,Industrials,Industrial Machinery/Components
LASR,nLIGHT Inc. Common Stock,United States,2018,Technology,Semiconductors
LAUR,Laureate Education Inc. Common Stock,United States,2017,Consumer Discretionary,Educational Services
LAW,CS Disco Inc. Common Stock,United States,2021,Technology,Computer Software: Prepackaged Software
LAZR,Luminar Technologies Inc.  Class A Common Stock,United States,2019,Consumer Discretionary,Auto Parts:O.E.M.
